[
  {
    "id": "azuchijo:source:shiga-castle",
    "type": "official-web-page",
    "citation": "滋賀県『特別史跡安土城跡の調査と整備』",
    "title": { "ja": "特別史跡安土城跡の調査と整備" },
    "creators": ["滋賀県"],
    "publishedYear": 2026,
    "url": "https://www.pref.shiga.lg.jp/sd00/2591.html",
    "accessedDate": "2026-10-02",
    "rights": { "status": "restricted", "terms": "引用メタデータのみ。本文・図版・地図画像は再現しない。" }
  },
  {
    "id": "azuchijo:source:omi8-castle",
    "type": "official-tourism-web-page",
    "citation": "近江八幡市観光物産協会『安土城跡』",
    "title": { "ja": "安土城跡" },
    "creators": ["近江八幡市観光物産協会"],
    "publishedYear": 2026,
    "url": "https://www.omi8.com/spot/detail_1217.html",
    "accessedDate": "2026-10-02",
    "rights": { "status": "restricted", "terms": "引用メタデータのみ。本文・写真・地図画像は再現しない。" }
  },
  {
    "id": "azuchijo:source:shape-notes",
    "type": "original-reconstruction-notes",
    "citation": "Chronomap『安土城・琵琶湖東岸パイロット形状作成メモ』",
    "title": { "ja": "安土城・琵琶湖東岸パイロット形状作成メモ" },
    "creators": ["Chronomap contributors"],
    "publishedYear": 2026,
    "url": "https://github.com/ywatase/chronomap/blob/main/docs/data/azuchijo-shape-notes.md",
    "accessedDate": "2026-10-02",
    "rights": { "status": "open-license", "attribution": "Chronomap contributors", "terms": "公開メタデータから作成した概略復元メモ。" }
  },
  {
    "id": "azuchijo:source:shiga-biwako-human",
    "type": "official-web-page",
    "citation": "滋賀県『琵琶湖と人の長いつきあい』",
    "title": { "ja": "琵琶湖と人の長いつきあい" },
    "creators": ["滋賀県"],
    "publishedYear": 2018,
    "url": "https://www.pref.shiga.lg.jp/biwakatsu/20521.html",
    "accessedDate": "2026-10-02",
    "rights": { "status": "restricted", "terms": "引用メタデータのみ。本文・写真・図版は再現しない。" }
  },
  {
    "id": "azuchijo:source:omi-control",
    "type": "official-report",
    "citation": "滋賀県『近江戦国探訪ガイドブック』",
    "title": { "ja": "近江戦国探訪ガイドブック" },
    "creators": ["滋賀県"],
    "publishedYear": 2018,
    "url": "https://www.pref.shiga.lg.jp/documents/2540/5161509_1.pdf",
    "accessedDate": "2026-10-04",
    "rights": { "status": "restricted", "terms": "引用メタデータのみ。本文・図版・地図画像は再現しない。" }
  },
  {
    "id": "azuchijo:source:omi-polity-shape",
    "type": "original-reconstruction-notes",
    "citation": "Chronomap『安土城・近江支配政治中枢形状作成メモ』",
    "title": { "ja": "安土城・近江支配政治中枢形状作成メモ" },
    "creators": ["Chronomap contributors"],
    "publishedYear": 2026,
    "url": "https://github.com/ywatase/chronomap/blob/main/docs/data/azuchijo-omi-polity-shape-notes.md",
    "accessedDate": "2026-10-04",
    "rights": { "status": "open-license", "attribution": "Chronomap contributors", "terms": "独自の概略復元メモ。" }
  },
  {
    "id": "azuchijo:source:jyorakuji-port",
    "type": "official-report",
    "citation": "滋賀県（安土城跡周辺の城下町ゾーン資料）",
    "title": { "ja": "安土城跡周辺の城下町ゾーン資料" },
    "creators": ["滋賀県"],
    "publishedYear": 2022,
    "url": "https://www.pref.shiga.lg.jp/file/attachment/5310843.pdf",
    "accessedDate": "2026-10-04",
    "rights": { "status": "restricted", "terms": "引用メタデータのみ。本文・図版・地図画像は再現しない。" }
  },
  {
    "id": "azuchijo:source:jyorakuji-port-shape",
    "type": "original-reconstruction-notes",
    "citation": "Chronomap『常楽寺湊代表点形状作成メモ』",
    "title": { "ja": "常楽寺湊代表点形状作成メモ" },
    "creators": ["Chronomap contributors"],
    "publishedYear": 2026,
    "url": "https://github.com/ywatase/chronomap/blob/main/docs/data/azuchijo-jyorakuji-port-shape-notes.md",
    "accessedDate": "2026-10-04",
    "rights": { "status": "open-license", "attribution": "Chronomap contributors", "terms": "独自の概略復元メモ。" }
  },
  {
    "id": "azuchijo:source:azuchi-settlement-shape",
    "type": "original-reconstruction-notes",
    "citation": "Chronomap『安土城下町推定範囲形状作成メモ』",
    "title": { "ja": "安土城下町推定範囲形状作成メモ" },
    "creators": ["Chronomap contributors"],
    "publishedYear": 2026,
    "url": "https://github.com/ywatase/chronomap/blob/main/docs/data/azuchijo-settlement-shape-notes.md",
    "accessedDate": "2026-10-04",
    "rights": { "status": "open-license", "attribution": "Chronomap contributors", "terms": "独自の概略復元メモ。" }
  },
  {
    "id": "azuchijo:source:shizugatake-battlefield",
    "type": "official-report",
    "citation": "長浜市『長浜市歴史文化基本構想 第4章』",
    "title": { "ja": "長浜市歴史文化基本構想 第4章" },
    "creators": ["長浜市"],
    "publishedYear": 2019,
    "url": "https://www.city.nagahama.lg.jp/cmsfiles/contents/0000008/8691/4s2-1.pdf",
    "accessedDate": "2026-10-04",
    "rights": { "status": "restricted", "terms": "引用メタデータのみ。本文・図版・地図画像は再現しない。" }
  },
  {
    "id": "azuchijo:source:shizugatake-shape",
    "type": "original-reconstruction-notes",
    "citation": "Chronomap『賤ヶ岳古戦場代表点形状作成メモ』",
    "title": { "ja": "賤ヶ岳古戦場代表点形状作成メモ" },
    "creators": ["Chronomap contributors"],
    "publishedYear": 2026,
    "url": "https://github.com/ywatase/chronomap/blob/main/docs/data/azuchijo-shizugatake-battlefield-shape-notes.md",
    "accessedDate": "2026-10-04",
    "rights": { "status": "open-license", "attribution": "Chronomap contributors", "terms": "独自の概略復元メモ。" }
  },
  {
    "id": "azuchijo:source:yogo-lake",
    "type": "official-web-page",
    "citation": "滋賀県『余呉湖（よごこ）』",
    "title": { "ja": "余呉湖（よごこ）" },
    "creators": ["滋賀県"],
    "publishedYear": 2026,
    "url": "https://www.pref.shiga.lg.jp/ha04/1427.html",
    "accessedDate": "2026-10-04",
    "rights": { "status": "restricted", "terms": "引用メタデータのみ。本文・写真・地図画像は再現しない。" }
  },
  {
    "id": "azuchijo:source:yogo-lake-shape",
    "type": "original-reconstruction-notes",
    "citation": "Chronomap『余呉湖歴史文脈形状作成メモ』",
    "title": { "ja": "余呉湖歴史文脈形状作成メモ" },
    "creators": ["Chronomap contributors"],
    "publishedYear": 2026,
    "url": "https://github.com/ywatase/chronomap/blob/main/docs/data/azuchijo-yogo-lake-shape-notes.md",
    "accessedDate": "2026-10-04",
    "rights": { "status": "open-license", "attribution": "Chronomap contributors", "terms": "独自の概略復元メモ。" }
  }
]
