[
  {
    "id": "tonegawa:source:mlit-plan-pdf",
    "type": "official-report",
    "citation": "国土交通省『利根川水系河川整備基本方針』",
    "title": { "ja": "利根川水系河川整備基本方針（概要）" },
    "creators": ["国土交通省"],
    "publishedYear": 2006,
    "url": "https://www.mlit.go.jp/river/basic_info/jigyo_keikaku/gaiyou/seibi/pdf/tonegawa/12_H18_gaiyou_tonegawa.pdf",
    "accessedDate": "2026-09-18",
    "rights": { "status": "restricted", "terms": "引用メタデータのみ。PDF本文、図版、地図画像は再現しない。" }
  },
  {
    "id": "tonegawa:source:mlit-river-guide",
    "type": "official-web-page",
    "citation": "国土交通省『利根川』日本の川",
    "title": { "ja": "利根川（日本の川）" },
    "creators": ["国土交通省"],
    "publishedYear": 2006,
    "url": "https://www.mlit.go.jp/river/toukei_chousa/kasen/jiten/nihon_kawa/0316_tonegawa/0316_tonegawa_01.html",
    "accessedDate": "2026-09-18",
    "rights": { "status": "restricted", "terms": "引用メタデータのみ。ページ本文、図版、地図画像は再現しない。" }
  },
  {
    "id": "tonegawa:source:saitama-cultural-pdf",
    "type": "official-report",
    "citation": "埼玉県『埼玉県の文化財』",
    "title": { "ja": "埼玉県の文化財" },
    "creators": ["埼玉県"],
    "publishedYear": 2025,
    "url": "https://www.pref.saitama.lg.jp/documents/27121/saitamaken_bunkazai_r7.pdf",
    "accessedDate": "2026-09-18",
    "rights": { "status": "restricted", "terms": "引用メタデータのみ。PDF本文、図版、地図画像は再現しない。" }
  },
  {
    "id": "tonegawa:source:shape-notes",
    "type": "original-reconstruction-notes",
    "citation": "Chronomap『利根川東遷パイロット形状作成メモ』",
    "title": { "ja": "利根川東遷パイロット形状作成メモ" },
    "creators": ["Chronomap contributors"],
    "publishedYear": 2026,
    "url": "https://github.com/ywatase/chronomap/blob/main/docs/data/tonegawa-shape-notes.md",
    "accessedDate": "2026-09-18",
    "rights": { "status": "open-license", "attribution": "Chronomap contributors", "terms": "Chronomapのオリジナルな概略復元メモ。外部資料の権利条件は個別Sourceに従う。" }
  }
]
