[
  {
    "id": "ogurike:source:codh",
    "type": "research-dataset",
    "citation": "『江戸末期湖沼データセット』doi:10.20676/00000467",
    "title": {
      "ja": "江戸末期湖沼データセット"
    },
    "creators": [
      "ROIS-DS人文学オープンデータ共同利用センター",
      "株式会社平凡社地図出版"
    ],
    "publishedYear": 2026,
    "url": "https://codh.rois.ac.jp/historical-gis/edo-lake/",
    "accessedDate": "2026-10-17",
    "rights": {
      "status": "open-license",
      "attribution": "『江戸末期湖沼データセット』doi:10.20676/00000467",
      "terms": "CC BY 4.0。Chronomapが形式変換・融合・簡略化した。"
    }
  },
  {
    "id": "ogurike:source:gsi-artificial-land",
    "type": "government-dataset",
    "citation": "国土地理院 ベクトルタイル提供実験「地形分類（人工地形）」experimental_landformclassification2",
    "title": {
      "ja": "地形分類（人工地形）"
    },
    "creators": [
      "国土地理院"
    ],
    "publishedYear": 2022,
    "url": "https://github.com/gsi-cyberjapan/experimental_landformclassification",
    "accessedDate": "2026-10-17",
    "rights": {
      "status": "open-license",
      "attribution": "国土地理院",
      "terms": "国土地理院コンテンツ利用規約"
    }
  },
  {
    "id": "ogurike:source:kyoto-city-monument",
    "type": "official-web-page",
    "citation": "京都市『巨椋池干拓碑』GA015",
    "title": {
      "ja": "巨椋池干拓碑"
    },
    "creators": [
      "京都市"
    ],
    "publishedYear": 2014,
    "url": "https://www2.city.kyoto.lg.jp/html/somu/rekishi/fm/ishibumi/html/ga015.html",
    "accessedDate": "2026-09-17",
    "rights": {
      "status": "restricted",
      "terms": "引用メタデータのみ。ページ本文、画像、碑文全文は再現しない。"
    }
  },
  {
    "id": "ogurike:source:kyoto-prefecture-rdb",
    "type": "official-web-page",
    "citation": "京都府レッドデータブック2015『巨椋池』",
    "title": {
      "ja": "巨椋池（京都府レッドデータブック）"
    },
    "creators": [
      "京都府"
    ],
    "publishedYear": 2015,
    "url": "https://www.pref.kyoto.jp/kankyo/rdb/geo/db/sur0005.html",
    "accessedDate": "2026-09-17",
    "rights": {
      "status": "restricted",
      "terms": "引用メタデータのみ。掲載された本文・地図画像・写真は再現しない。"
    }
  },
  {
    "id": "ogurike:source:mlit-ogurike-transition",
    "type": "official-report",
    "citation": "国土交通省近畿地方整備局『流域及び河川の概要について』図2.2-1 巨椋池周辺の変遷",
    "title": {
      "ja": "巨椋池周辺の変遷（国土交通省近畿地方整備局）"
    },
    "creators": [
      "国土交通省近畿地方整備局"
    ],
    "publishedYear": 2012,
    "url": "https://www.kkr.mlit.go.jp/river/iinkaikatsudou/kensyou/qgl8vl0000008nhe-att/houkokusyos_02.pdf",
    "accessedDate": "2026-09-17",
    "rights": {
      "status": "open-license",
      "attribution": "国土交通省近畿地方整備局",
      "terms": "PDL1.0。出典を記載し、編集・加工したことを別途表示する。"
    }
  },
  {
    "id": "ogurike:source:shape-notes",
    "type": "original-reconstruction-notes",
    "citation": "Chronomap『巨椋池パイロット形状作成メモ』",
    "title": {
      "ja": "巨椋池パイロット形状作成メモ"
    },
    "creators": [
      "Chronomap contributors"
    ],
    "publishedYear": 2026,
    "url": "https://github.com/ywatase/chronomap/blob/main/docs/data/ogurike-shape-notes.md",
    "accessedDate": "2026-09-17",
    "rights": {
      "status": "open-license",
      "attribution": "Chronomap contributors",
      "terms": "Chronomapのオリジナルな概略復元メモ。外部資料の権利条件は個別Sourceに従う。"
    }
  }
]
