[
  {
    "id": "osaka:source:bay-vision",
    "type": "official-report",
    "citation": "大阪府『大阪広域ベイエリアまちづくりビジョン（素案）』",
    "title": { "ja": "大阪広域ベイエリアまちづくりビジョン（素案）" },
    "creators": ["大阪府"],
    "publishedYear": 2021,
    "url": "https://www.pref.osaka.lg.jp/documents/2275/0520shiryou1-2_2.pdf",
    "accessedDate": "2026-10-04",
    "rights": { "status": "restricted", "terms": "引用メタデータのみ。PDF本文・図版・地図画像は再現しない。" }
  },
  {
    "id": "osaka:source:city-history",
    "type": "official-web-page",
    "citation": "大阪市『大阪市の歴史－タイムトリップ20,000年（飛鳥・奈良時代以降）』",
    "title": { "ja": "大阪市の歴史－タイムトリップ20,000年（飛鳥・奈良時代以降）" },
    "creators": ["大阪市"],
    "publishedYear": 2026,
    "url": "https://www.city.osaka.lg.jp/seisakukikakushitsu/page/0000010252.html",
    "accessedDate": "2026-10-04",
    "rights": { "status": "restricted", "terms": "引用メタデータのみ。ページ本文・写真・図版は再現しない。" }
  },
  {
    "id": "osaka:source:ishiyama-site",
    "type": "official-web-page",
    "citation": "大阪市中央区『石山（大坂）本願寺推定地』",
    "title": { "ja": "石山（大坂）本願寺推定地" },
    "creators": ["大阪市中央区"],
    "publishedYear": 2026,
    "url": "https://www.city.osaka.lg.jp/chuo/page/0000641506.html",
    "accessedDate": "2026-10-04",
    "rights": { "status": "restricted", "terms": "引用メタデータのみ。本文・写真・説明板画像は再現しない。" }
  },
  {
    "id": "osaka:source:shape-notes",
    "type": "original-reconstruction-notes",
    "citation": "Chronomap『大坂・石山本願寺と河内湾形状作成メモ』",
    "title": { "ja": "大坂・石山本願寺と河内湾形状作成メモ" },
    "creators": ["Chronomap contributors"],
    "publishedYear": 2026,
    "url": "https://github.com/ywatase/chronomap/blob/main/docs/data/osaka-shape-notes.md",
    "accessedDate": "2026-10-04",
    "rights": { "status": "open-license", "attribution": "Chronomap contributors", "terms": "公開メタデータから作成した概略復元メモ。" }
  }
]
