[{"accessedDate":"2026-10-19","citation":"千葉県立中央博物館『古代・中世の香取の海と水陸交通』","creators":["千葉県立中央博物館"],"id":"katori-sea:source:chiba-museum-figure","publishedYear":2026,"rights":{"status":"restricted","terms":"引用メタデータのみ。掲載図は再配布・トレースしない。"},"title":{"ja":"古代・中世の香取の海と水陸交通"},"type":"museum-publication","url":"https://www.chiba-muse.or.jp/NATURAL/cms/wp-content/uploads/2026/03/katorijinguten_zuroku.pdf"},{"accessedDate":"2026-10-19","citation":"Chronomap『香取海 形状作成メモ』","creators":["Chronomap contributors"],"id":"katori-sea:source:chronomap-notes","publishedYear":2026,"rights":{"attribution":"Chronomap contributors","status":"open-license","terms":"Chronomapのモデル手法・概略補正。外部資料の権利条件は個別Sourceに従う。"},"title":{"ja":"香取海 形状作成メモ"},"type":"original-reconstruction-notes","url":"https://github.com/ywatase/chronomap/blob/main/docs/data/katori-sea-shape-notes.md"},{"accessedDate":"2026-10-19","citation":"国土地理院 住所検索API（県名・市名付き検索、2026年10月19日）","creators":["国土地理院"],"id":"katori-sea:source:gsi-address-search","publishedYear":2026,"rights":{"attribution":"国土地理院","status":"open-license","terms":"国土地理院コンテンツ利用規約。住所検索の応答座標を位置基準に使用。"},"title":{"ja":"地理院地図 住所検索API"},"type":"official-api","url":"https://msearch.gsi.go.jp/address-search/AddressSearch?q="},{"accessedDate":"2026-10-19","citation":"国土地理院 地理院タイル「標高データ」（DEM5a・DEM10b、2026年10月取得）","creators":["国土地理院"],"id":"katori-sea:source:gsi-dem","publishedYear":2026,"rights":{"attribution":"国土地理院","status":"open-license","terms":"国土地理院コンテンツ利用規約。出典と加工内容を表示。"},"title":{"ja":"地理院タイル 標高データ"},"type":"government-dataset","url":"https://cyberjapandata.gsi.go.jp/development/demtile.html"},{"accessedDate":"2026-10-19","citation":"香取市『香取遺産 Vol.148 香取の海と新島十六島』広報かとり 平成30年4月号","creators":["香取市"],"id":"katori-sea:source:katori-city-vol148","publishedYear":2018,"rights":{"status":"restricted","terms":"引用メタデータのみ。掲載図は再配布・トレースしない。"},"title":{"ja":"香取の海と新島十六島"},"type":"official-web-page","url":"https://www.city.katori.lg.jp/culture_sport/bunkazai/isan/141-150.html"},{"accessedDate":"2026-10-19","citation":"香取市『香取遺産 Vol.208 香取の海と新田開発』広報かとり 令和5年12月号","creators":["香取市"],"id":"katori-sea:source:katori-city-vol208","publishedYear":2023,"rights":{"status":"restricted","terms":"引用メタデータのみ。掲載図は再配布・トレースしない。"},"title":{"ja":"香取の海と新田開発"},"type":"official-web-page","url":"https://www.city.katori.lg.jp/culture_sport/bunkazai/isan/201-210.html"},{"accessedDate":"2026-10-19","citation":"国土交通省 関東地方整備局『「利根川の東遷」と「荒川の西遷」』","creators":["国土交通省 関東地方整備局"],"id":"katori-sea:source:mlit-tone-eastward","publishedYear":2013,"rights":{"status":"restricted","terms":"引用メタデータのみ。本文・図は再配布しない。"},"title":{"ja":"利根川の東遷と荒川の西遷"},"type":"official-report","url":"https://www.ktr.mlit.go.jp/ktr_content/content/000853737.pdf"}]
