[
  {
    "accessedDate": "2026-10-04",
    "citation": "滋賀県『信長の城と戦国近江』",
    "creators": [
      "滋賀県"
    ],
    "id": "azuchijo:source:omi-control",
    "publishedYear": 2018,
    "rights": {
      "status": "restricted",
      "terms": "引用メタデータのみ。本文・図版・地図画像は再現しない。"
    },
    "title": {
      "ja": "信長の城と戦国近江"
    },
    "type": "official-report",
    "url": "https://www.pref.shiga.lg.jp/file/attachment/4035617.pdf"
  },
  {
    "accessedDate": "2026-10-02",
    "citation": "近江八幡市観光物産協会『安土城跡』",
    "creators": [
      "近江八幡市観光物産協会"
    ],
    "id": "azuchijo:source:omi8-castle",
    "publishedYear": 2026,
    "rights": {
      "status": "restricted",
      "terms": "引用メタデータのみ。本文・写真・地図画像は再現しない。"
    },
    "title": {
      "ja": "安土城跡"
    },
    "type": "official-tourism-web-page",
    "url": "https://www.omi8.com/spot/detail_1217.html"
  },
  {
    "accessedDate": "2026-10-02",
    "citation": "Chronomap『安土城・琵琶湖東岸パイロット形状作成メモ』",
    "creators": [
      "Chronomap contributors"
    ],
    "id": "azuchijo:source:shape-notes",
    "publishedYear": 2026,
    "rights": {
      "attribution": "Chronomap contributors",
      "status": "open-license",
      "terms": "公開メタデータから作成した概略復元メモ。"
    },
    "title": {
      "ja": "安土城・琵琶湖東岸パイロット形状作成メモ"
    },
    "type": "original-reconstruction-notes",
    "url": "https://github.com/ywatase/chronomap/blob/main/docs/data/azuchijo-shape-notes.md"
  },
  {
    "accessedDate": "2026-10-02",
    "citation": "滋賀県『琵琶湖と人の長いつきあい』",
    "creators": [
      "滋賀県"
    ],
    "id": "azuchijo:source:shiga-biwako-human",
    "publishedYear": 2018,
    "rights": {
      "status": "restricted",
      "terms": "引用メタデータのみ。本文・写真・図版は再現しない。"
    },
    "title": {
      "ja": "琵琶湖と人の長いつきあい"
    },
    "type": "official-web-page",
    "url": "https://www.pref.shiga.lg.jp/biwakatsu/20521.html"
  },
  {
    "accessedDate": "2026-10-02",
    "citation": "滋賀県『特別史跡安土城跡の調査と整備』",
    "creators": [
      "滋賀県"
    ],
    "id": "azuchijo:source:shiga-castle",
    "publishedYear": 2026,
    "rights": {
      "status": "restricted",
      "terms": "引用メタデータのみ。本文・図版・地図画像は再現しない。"
    },
    "title": {
      "ja": "特別史跡安土城跡の調査と整備"
    },
    "type": "official-web-page",
    "url": "https://www.pref.shiga.lg.jp/sd00/2591.html"
  }
]
