[
  {
    "accessedDate": "2026-10-05",
    "citation": "岐阜関ケ原古戦場記念館『石田三成コース』",
    "creators": [
      "岐阜県・岐阜関ケ原古戦場記念館"
    ],
    "id": "sekigahara:source:ishida-course",
    "publishedYear": 2020,
    "rights": {
      "status": "restricted",
      "terms": "引用メタデータのみ。本文・写真・ダウンロード地図は再現しない。"
    },
    "title": {
      "ja": "石田三成コース｜古戦場・史跡巡り"
    },
    "type": "official-web-page",
    "url": "https://sekigahara.pref.gifu.lg.jp/ishida-mitsunari/"
  },
  {
    "accessedDate": "2026-10-05",
    "citation": "岐阜関ケ原古戦場記念館『岐阜関ケ原古戦場記念館について』",
    "creators": [
      "岐阜県・岐阜関ケ原古戦場記念館"
    ],
    "id": "sekigahara:source:memorial-about",
    "publishedYear": 2020,
    "rights": {
      "status": "restricted",
      "terms": "引用メタデータのみ。ページ本文・写真・展示映像は再現しない。"
    },
    "title": {
      "ja": "岐阜関ケ原古戦場記念館について"
    },
    "type": "official-web-page",
    "url": "https://sekigahara.pref.gifu.lg.jp/about/"
  },
  {
    "accessedDate": "2026-10-05",
    "citation": "Chronomap『関ケ原古戦場・中山道形状作成メモ』",
    "creators": [
      "Chronomap contributors"
    ],
    "id": "sekigahara:source:shape-notes",
    "publishedYear": 2026,
    "rights": {
      "attribution": "Chronomap contributors",
      "status": "open-license",
      "terms": "公開メタデータから作成した概略復元メモ。"
    },
    "title": {
      "ja": "関ケ原古戦場・中山道形状作成メモ"
    },
    "type": "original-reconstruction-notes",
    "url": "https://github.com/ywatase/chronomap/blob/main/docs/data/sekigahara-shape-notes.md"
  },
  {
    "accessedDate": "2026-10-05",
    "citation": "関ケ原町『関ケ原町過疎地域持続的発展計画』",
    "creators": [
      "関ケ原町"
    ],
    "id": "sekigahara:source:town-plan",
    "publishedYear": 2021,
    "rights": {
      "status": "restricted",
      "terms": "引用メタデータのみ。PDF本文・図版・地図画像は再現しない。"
    },
    "title": {
      "ja": "関ケ原町過疎地域持続的発展計画"
    },
    "type": "official-report",
    "url": "https://www.town.sekigahara.gifu.jp/secure/6543/R7keikaku.pdf"
  }
]
