[
  {
    "accessedDate": "2026-09-18",
    "citation": "奈良市『奈良のあゆみ－明治以前－』",
    "creators": [
      "奈良市"
    ],
    "id": "heijokyo:source:nara-heijokyo",
    "publishedYear": 2019,
    "rights": {
      "status": "restricted",
      "terms": "引用メタデータのみ。本文・図版・地図画像は再現しない。"
    },
    "title": {
      "ja": "奈良のあゆみ－明治以前－"
    },
    "type": "official-web-page",
    "url": "https://www.city.nara.lg.jp/soshiki/3/148230.html"
  },
  {
    "accessedDate": "2026-09-18",
    "citation": "奈良市『平城京朱雀大路跡』",
    "creators": [
      "奈良市"
    ],
    "id": "heijokyo:source:nara-suzaku",
    "publishedYear": 2021,
    "rights": {
      "status": "restricted",
      "terms": "引用メタデータのみ。本文・図版・地図画像は再現しない。"
    },
    "title": {
      "ja": "平城京朱雀大路跡"
    },
    "type": "official-web-page",
    "url": "https://www.city.nara.lg.jp/site/bunkazai/2438.html"
  },
  {
    "accessedDate": "2026-09-18",
    "citation": "Chronomap『平城京パイロット形状作成メモ』",
    "creators": [
      "Chronomap contributors"
    ],
    "id": "heijokyo:source:shape-notes",
    "publishedYear": 2026,
    "rights": {
      "attribution": "Chronomap contributors",
      "status": "open-license",
      "terms": "独自の概略復元メモ。"
    },
    "title": {
      "ja": "平城京パイロット形状作成メモ"
    },
    "type": "original-reconstruction-notes",
    "url": "https://github.com/ywatase/chronomap/blob/main/docs/data/heijokyo-shape-notes.md"
  }
]
