[
  {
    "id": "heijokyo:source:nara-heijokyo",
    "type": "official-web-page",
    "citation": "奈良市『奈良のあゆみ－明治以前－』",
    "title": { "ja": "奈良のあゆみ－明治以前－" },
    "creators": ["奈良市"],
    "publishedYear": 2019,
    "url": "https://www.city.nara.lg.jp/soshiki/3/148230.html",
    "accessedDate": "2026-09-18",
    "rights": { "status": "restricted", "terms": "引用メタデータのみ。本文・図版・地図画像は再現しない。" }
  },
  {
    "id": "heijokyo:source:nara-suzaku",
    "type": "official-web-page",
    "citation": "奈良市『平城京朱雀大路跡』",
    "title": { "ja": "平城京朱雀大路跡" },
    "creators": ["奈良市"],
    "publishedYear": 2021,
    "url": "https://www.city.nara.lg.jp/site/bunkazai/2438.html",
    "accessedDate": "2026-09-18",
    "rights": { "status": "restricted", "terms": "引用メタデータのみ。本文・図版・地図画像は再現しない。" }
  },
  {
    "id": "heijokyo:source:shape-notes",
    "type": "original-reconstruction-notes",
    "citation": "Chronomap『平城京パイロット形状作成メモ』",
    "title": { "ja": "平城京パイロット形状作成メモ" },
    "creators": ["Chronomap contributors"],
    "publishedYear": 2026,
    "url": "https://github.com/ywatase/chronomap/blob/main/docs/data/heijokyo-shape-notes.md",
    "accessedDate": "2026-09-18",
    "rights": { "status": "open-license", "attribution": "Chronomap contributors", "terms": "独自の概略復元メモ。" }
  }
]
